page	refimg	numauto	chapitre
208	0218	804197	Degré. Dégustation. Déjection. Délayant. Délétère. Délibérer. Déligation. Déliquescence. Déliquescent. Deliquium. Délirant. Délire. Délirer. Délitescence. Délivrance. Délivre. Délivrer. Delphinate. Delphinine. Deltoïde
209	0219	804198	Deltoïde. Deltoïdien. Déluter. Démangeaison. Démence. Demi-aponévrotique. Demi-azygos. Demi-bain. Demi-circulaire. Demi-épineux. Demi-interosseux. Demi-membraneux. Demi-métal. Demi-nerveux. Demi-orbiculaire. Demi-tendineux. Démonologie. Démonomancie. Déniaii. Denis-les-Bois (Saint-). Dense. Densité
210	0220	804199	Densité. Dent. Dentaire. Dentaire. Dentelaire. Dentelé
211	0221	804200	Dentelé. Denticule. Dentier. Dentiforme. Dentifrice. Dentiste. Dentition. Dents. Denture. Dénudation. Départ ou linquart. Dépérissement. Déphlegmation
212	0222	804201	Déphlegmation. Déphlogistique. Dépilation. Dépilatoire. Déplacement. Dépôt. Dépravation. Dépression. Dépressoir. Déprimé. Dépuratif. Dépuration. Dépuratoire. Dépuré. Dérencéphale. Dérivatif. Dérivation. Dériver. Dermatite. Dermatoïde
213	0223	804202	Derme. Dermographie. Dermoïde. Dermologie. Dermotomie. Dérobé. Dérober (se). Derval. Désarçonner. Désarticulation. Désarticulé. Désarticuler. Désassimilateur. Désassimilation. Descalorinèses. Descente. Désenflure. Désentraver. Désergoter. Désinfecter. Désinfection. Desmographie. Desmologie. Desmophlogie. Desmotomie. Désobstruant. Désobstructif. V. Désobstruant. Désopilant. V. Désobstruant, apéritif. Désopilatif. V. Désopilant. Désopilation. Désorganisation
214	0224	804203	Désorganisation. Désoxydation, désoxygénation. Désoxyder. Désoxygénation. V. Désoxydation. Désoxygéné. Désoxygéner. V. Désoxyder. Despotat. Despumation. Despumé. Desquamation. Desséchement. Dessiccatif. Dessiccation. Dessoler. Destrier ou détrier. Désudation. Désuintage. Désuni. Desvres. Détergent. V. Détersif. Déterger. Détersif. Détonation. Détorsion. Détraqué. Detritus. Détroit. Détroncation. Détumescence. Deutérie
215	0225	804204	Deutérie. Deutéropathie. Deutéropathique. Développement. Déviation. Dévoiement. Diabète. Diabétique. Diablotin. Diabotanum. Diabrose. Diabrotique. Diacarcinon. Diacarthame. Diacassis. Diacatholicum. Diacausie. Diacaustique. Diachalasis. Diachalciteos. Diachylon ou diachylum. Diacode
216	0226	804205	Diacode. Diacolocynthidos. Diacopé. Diacoprégie. Diacoustique. Diacranien. Diacrèse. V. Crise. Diacrocie. Diacurcuma. Diacydonite. Diadaphedon. Diadexie. Diadoche. Diagnose. Diagnostic. Diagnostique. Diagrède. Diahermodactyle. Diaion. Diaire. Diaireos. Dialacca. Dialagoon. Dialeipyre. Dialepsie. Dialibonon. Dialoès. Dialthée. Dialyse. Diamant
217	0227	804206	Diamant. Diamargaritum. Diamarmatum. Diamètre. Diamorum. Diamoschu. Dianacardion. Diane. Dianitrie. Dianthon ou dianthum. Dianucum. Diaoliban. Diaopobon. Diapalme. Diapasme. Diapédèse. Diapeute. Diaphane. Diaphanéité. Diaphoenix. Diaphorèse. Diaphorétique. Diaphragmatique
218	0228	804207	Diaphragmatique. Diaphragmatite. Diaphragmatocèle. Diaphragme. Diaphragmite. V. Diaphragmatite. Diaphthora. Diaphylactique. V. Prophylactique. Diaphyse. Diapnoïque. V. Diapnotique. Diapnotique. Diaprun. Diapyétique. V. Maturatif, suppuratif. Diarrhage. Diarrhée. Diarrhodon. Diarthrodial. Diarthrose. Diasatyrion. Diascordium. Diasebeste. Diasenna. Diasostique. Diasostique. Diaspennatum. Diastase. Diastole
219	0229	804208	Diastole. Diastrophie. Diatartari. Diatessaron. Diatettigon. Diathecolithu. Diathèse. Diatonique. Diatragacanthe. Diatrion. Diatritaire. Diazoma. Diazoster. Dicq. Dicrote. Dictame blanc. V. Fraxinelle blanche. Dictamnite. Dictyoides. Didymalgie. Dié (Saint-). Dierenbach. Diérèse. Diéresile. Diérésilien. Diérétique. Diète
220	0230	804209	Diète. Diététique. Diététique. Diététiste. Dieu-le-fit. Difformité. Diffraction. Diffus. Diffusible. Diffusion. Digastrique. Dige. Digesteur. V. Marmite de Papin. Digestif. Digestion. Digital. Digitale
221	0231	804210	Digitale. Digitaline. Digitation. Digne. Dil. Dilacération. Dilatabilité. Dilatant. Dilatateur. Dilatateur. Dilatatoire. V. Dilatateur. Dilater. Dimension. Dinan. Dioponcéphale. Dioncose. Diophthalme. Dioptre. Dioptrique. Diorrhèse. V. Diorrhose. Diorrhose. Diorthose. Diploé. Diploïque ou diploétique. Diplôme. Diplopie. Diplotège
222	0232	804211	Diplotège. Dipsétique. Dirradiation.Discret. Discrimen. Discussif. Dislocation. Dispensaire. Dispensation. Dispersion. Disposition. Dissection. Dissemblable. Disséquer. Dissimilaire. Dissimulé. Dissoluble. Dissolution. Dissolvant. Distension. Distichiase. Distillation
223	0233	804212	Distillation. Distillé. Distiller. Distorsion. Ditrachyceros. Diurèse. Diurétique. Diurne. Divergent. Diverticule. Divination. Divisif. Division. Divulsion. Docimasie. Docimasologie. Docimastique. Doctrine. Dogmatique. Dogmatisme. Doigt. Dol. Doloire
224	0234	804213	Doloire. Dôme ou réverbère. Dompter. Donner. Dorsal. Dorso-acromien. Dorso-costal. Dos. Dose. Doser. Dothien. Douce-amère. Douche. Douleur
225	0235	804214	Douleur. Douve. Doux. Drachme. V. Dragme. Dragé. Dragée. Dragme. Dragonneau. Dragonnier. Drapeau. Drastique. Drèche ou malt. Dresser. Drimyphagie. Drogue. Droguier. Droguiste. Droit. Droit de l'abdomen
226	0236	804215	Droit de l'abdomen. Dropacisme. V. Dépilation. Dropax. Dualisme. Dualiste. Ductile. Ductilité. Ducto-conchien. Dulcification. Dulcifié. Duodénal. Duodénite
227	0237	804216	Duodénum. Duplicature. Dur. Dure-mère. Duretal. Dureté. Durillon. Duumvirat. Dynamique. Dynamomètre. Dyonisien. Dysarthrite. Dysarthrose. Dyscatabrose. Dyscatapose. Dyscholie. Dyschroïe. Dyschylie. Dyschymie. Dyscinésie. Dyscoïlie. Dyscrasie. Dysdacrie. Dyseccrise. Dysécie. Dysécoïe. Dysenterie
228	0238	804217	Dysenterie. Dysentérique. Dysesthétérie. Dysgalie. Dysgennésie. Dysgeusie. Dyshaphie. Dyshémie. Dyshémorrhée. Dyshydrie. Dyslalie. Dyslochie. Dysménie. Dysménorrhée. Dysodie. Dysodontiase. Dysopie. Dysorexie. Dysosmie. Dysosphrésie. Dysostose. Dyspepsie. Dyspermasie. Dyspermatisme. V. Dyspermasie. Dyspermite. Dysphagie. Dysphonie. Dysphorie. Dyspionie. Dyspnée. Dyspnéique. Dyssialie. Dyssynusie. Dysthélasie. Dysthésie. Dysthymie. Dystocie ou dystokie. Dystocologie. Dystoechiase. Dystonie
229	0239	804218	Dysurésie. Dysurie. E. Eau
230	0240	804219	Eau
231	0241	804220	Eau
232	0242	804221	Eau. Eautognosie. Eaux. Ebat. Ebeaupin. Ebet
233	0243	804222	Ebet. Eblouissement. Ebrouement. Ebrouer. Ebullition. Eburné. Eburnification. Ecaille. Ecailleux. Ecaillon. Ecart. Ecbolique. Ecbyrsome. Eccathartique. V. Cathartique. Ecchymome. V. Ecchymose. Ecchymose. Ecclise. Eccope. Eccopeus. Eccoprotique. Eccorthatique. Eccrinologie. Ecdore. Echalote. Echancrure
234	0244	804223	Echancrure. Echappé. Echapper. Echarde. Echarpe. Echauboulures. Echaudillon. Echauffant. Echauffement. Echelle. Echine. Echinocoque. Echinophthalmie. Echinorhynque. Echo. Echomètre. Eclair. Eclaire. Eclampsie. Eclectique
235	0245	804224	Eclectisme. Eclegme. Eclisse. Economie. Ecorce. Ecorchure. Ecoulement. Ecourté. Ecouvette. Ecphractique. Ecphyas. Ecphyse. Ecphysèse
236	0246	804225	Ecpiesme. Ecplérome. Ecplexie. Ecpnoé. Ecptome. Ecpyème. Ecpyésis. V. Ecpyème. Ecpyétique. Ecrevisse. Ecrexis. Ecrhythne. Ecrouelles. Ecrysis. Ecsarcome. Ectase. Ecthélynsis. Ecthlimme. Ecthymate. Ecthyme. Ectillotique. Ectome. Ectopie. Ectopisie. Ectopocyste. Ectopocystique. Ectoprotique. V. Eccoprotique. Ectrimme. Ectropion. Ectrose. Ectrotique. Ectylotique
237	0247	804226	Ectylotique. Ecume. Ecusson. Ecuyer. Eczème. Eczsèse. Eczesme. V. Eczème. Edenté. Edessenum. Edulcoration. Efférent. Effervescence. Effervescent. Efficace. Efficient. Efflanqué. Effleurir (s'). Efflorescence. Efflorescent. Efflux. Effluxion. Effort. Effracture. Effusion. Egagropile
238	0248	804227	Egagropile. Egal. Egaré. Egarroté. Egilope. V. Aegilops. Egilops. V. Aegilops. Eglander. Egophonie. Egra. Ehanché. Eilsen. Ejaculateur. Ejaculation. Ejaculatoire. Ejection. Elaboration. Elaeomel. V. Eleomel. Elaeosaccharum. V. Eleosaccharum. Elaguir. Elaine. Elan. Elancement. Elas martis. Elasticité. Elastique. Elaterium
239	0249	804228	Elaterium. Elatéromètre. Electif. Election. Electricité. Electrique
240	0250	804229	Electrique
241	0251	804230	Electrisation. Electriser. Electrochémisme. Electrogène. Electrologie. Electromètre. Electromoteur. Electrophore. Electroscope. Electuaire
242	0252	804231	Electuaire. Elément. Elémentaire. Elemi. Eléoméli. Eléo-saccharum. Eléphantiasis. Eléphantique. Eléphantope. Elévateur
243	0253	804232	Elévateur. Elévation. Elévatoire. Elevure. Eliquation. V. Colliquation. Elixation. Elixir
244	0254	804233	Elixir. Elixiviation. V. Lixiviation. Ellébore. V. Hellébore. Elléborisme. V. Helléborisme. Elongation. Elutriation. Eluxation. V. Luxation. Elytrocèle. Elytroïde. Elytroïte ou elytrite. Elytroptose. Elytrorrhagie. Emaciation. Emacié. Email des dents. Emaillé. Emanation. Emasculation. Emasculer. Embarras
245	0255	804234	Embarras. Embarrer (s'). Embarrure. Embaumement. Emblic. V. Mirobolan emblic. Embole. Embonpoint. Emborisme. Emboucher. Embrocation. Embryoctonie. Embryographie. Embryologie. Embryon. Embryothlaste. Embryotocie. Embryotome. Embryotomie. Embryulce. Embryulcie. Eméril. Emétine. Emétique
246	0256	804235	Emétique. Emétiser. Eméto-cathartique. Emétologie. Eminence. Emissaire. Emissif. Emission. Emménagogue. Emménagologie. Emménologie. Emmiellure. Emollient. Emonctoire. Emotion. Empasme. Empatement. Empêtrer. Emphractique. Emphragme.  Emphraxie. Emphysème. Empirique. Empirisme
247	0257	804236	Empirisme. Emplastique. Emplastropoièse. Emplâtre
248	0258	804237	Emplâtre
249	0259	804238	Emplâtre. Empneumatose. Empoisonné. Empoisonnement. Empoisonner. Empore. Emporter (s'). Empreinte. Emprosthotonos. Empsychose. Emptoïque. Empyème. Empyocèle. Empyomphale. Empyreumatique. Empyreume. Emulgent. Emulsif. Emulsion
250	0260	804239	Enantesis. Enantiose. Enarthrose. Encanthis. Encapuchonner (s'). V. Armer (s'). Encastelé. V. Encastelure. Encastelure. En-cataal. Encatalepsie. Encaume. Encausse. Encavure. V. Argema. Encéllalgie. Encelite. Encens. V. Oliban. Encéphalalgie. Encéphale. Encéphalique. Encéphalite. Encéphalocèle. Encéphaloïde. Encéphalotomie. Encharaxie. Enchatonnement. V. Chatonnement
251	0261	804240	Enchevestrure. V. Chevestre, licol. Enchifrené. Enchifrenement. Enchyme. Enchynome. Enchymose. V. Enchymome. Enclavé. Enclavement. Enclaver (s'). Enclouer. Enclume. Enclysme. V. Clystère. Encolpisme. Encolure. Encopé. Encorné. Endémique. Endophragme. Endose. Endrome. Enduit. Endurcissement. Enéorème. Energie. Enervation
252	0262	804241	Enervation. Enerver. Enfance. Enfant. Enfantement. Enfer de Boyle. Enflammé. Enflammer (s'). Enflure. Engastriloque. Engastrimandre. V. Engastrimythe. Engastrimysme. Engastrimythe. Engelure. Enghien. Engissome. Engorgé. Engorgement. Engouement. Engouer (s'). Engourdi. Engourdir (s'). Engourdissement. Engrenure. V. Suture. Enharmonique. Enkysté. Enkystement. V. Chatonnement. Enormon. Enrhythme. Enrouement. Ens
253	0263	804242	Ens. Ensal. Ensellé. Ensiforme. Ensisternal. Entaille. Entendement. Entéradénographie. Entéradénologie. Entéralgie. Entérangiemphraxie. Entérélesie. Entérenchyta. Entérique. Entérite. Entérocèle. Entérocélie. Entéro-cystocèle. Entéro-épiplocèle. Entéro-épiplomphale. Entérogastrocèle. Entérographie. Entéro-hydrocèle. Entéro-hydromphale. Entéro-ischiocèle
254	0264	804243	Entéro-ischiocèle. Entérolithiasie. Entérologie. Entéro-mérocèle. Entéro-mésentérique. Entéromiasie. Entéromphale. Entéropéristole. Entérophlogie. Entéropyrie. Entéro-raphé. V. Entéroraphie. Entéroraphie. Entérorrhagie. Entérorrhée. Entéro-sarcocèle. Entéroschéocèle. Entérotomie. Enthlasie. Entité. Entohyal. Entomologie. Entomologiste. Entonnoir. Entorse
255	0265	804244	Entozoaires. Entrailles. Entraves. Entrecouper (s'), entretailler (s'). Entrepas. V. Aubin. Entrichoma. Entypose. Enucléation. Enula-campana. V. Aunée. Enurésie. Envie. Enzootie. Eolipyle. Epactal. Epagoge. Epagogue. Epanadiplosie. Epanastasie. Epanchement. Epancylote. Epaphèrèse. Eparme. Eparsie. V. Eparme. Eparvin. Epaule. Epeautre. Epée. Eperlan. Eperon. Epervier
256	0266	804245	Epervier. Ephère. Ephédrane. Ephelce. Ephélide. Ephémère. Ephéméropyre. Ephialte. Ephidrose. Ephippion. Ephode. Epi. V. Spica. Epial. Epialte. V. Ephialte. Epicarpe. Epicaume. Epice. V. Epicerie. Epicérastique. Epicerie. Epichole. Epichorde. Epichorion. Epichorique. Epicoele. Epicoemasie. Epicolique
257	0267	804246	Epicolique. Epicondyle. Epicondylo-cubital. Epicophose. V. Cophose. Epicrane. Epicranien. Epicrase. Epicrise. Epidémie. Epidémique. Epiderme. Epidermique. Epidermoïde. Epidèse. Epidesme. Epididyme. Epidose. Epidrome. Epigastralgie. Epigastre. Epigastrique. Epigastrocèle. Epigénèse
258	0268	804247	Epigénèse. Epiginomène. Epiglotte. Epiglotti-aryténoïdien. Epiglottique. Epiglottite. Epigloute. Epigonate. Epigone. Epilampsie. V. Eclampsie. Epilatoire. V. Dépilatoire. Epilempsie. V. Epilepsie. Epilepsie. Epileptique. Epinard. Epine
259	0269	804248	Epine. Epineux. Epingle. Epinière. Epinotion. Epinyctide. Epiphanie. Epiphénomène. Epiphlogisme. Epiphora. Epiphragme. Epiphysaire. Epiphyse. Epipigme. Epiplasme. V. Cataplasme. Epiplérose. Epiplocèle. Epiplo-entérocèle. Epiploïque. Epiplo-ischiocèle. Epiploïte. Epiplomérocèle
260	0270	804249	Epiplomérocèle. Epiplomphale. Epiplo-omphale. V. Epiplomphale. Epiplomphrase. Epiploon. Epiplo-sarcomphale. Epiploschéocèle. Epipolase. Epipome. V. Epipigme. Epirrhée. Epischèse. Epischion. Episemasie. Episiocèle. Epision. Episiorrhagie. Epispadias. Epispasme. Epispastique. Episphérie. Epistaphylin. Epistase. Epistaxis. Episternal
261	0271	804250	Episthotonos. Epistrophé. Epistrophico-occipital. Epistrophique de l'atlas. Episynanche. Episynangine. V. Episynanche. Episynthétisme. Epitase. Epithelium. Epithème. Epitrochlée, epitroklée. Epitrochlo-métacarpien. Epizootie. Epizootique. Epointé. Epome. Eponge. Epreintes. Epsom. Epuisement
262	0272	804251	Epuisement. Epulide. V. Epulie. Epulie. Epulotique. Epurge. Equilibre. Equinoxe. Equinoxial. Equitation. Equivoque. Eradicatif. Eraillement. Erecteur. Erectile. Erectilité. Erection. Eréthisie. Eréthisme. Erford. Ergot
263	0273	804252	Ergotisme. Erigne. Erosion. Erotique. Erotomanie. Erpétologie. Erpétologiste. Err. Erratique. Erres. Erreur. Errhin. Errhipsie. Eructation. Erugineux. Eruptif. Eruption. Erysipélateux. Erysipèle. Erythématique. Erythème. Erythrique. Erythroïde
264	0274	804253	Erythroïde. Erythrostome. Esaphe. Escapade. Escarre. V. Eschare. Escarrotique. V. Escharotique. Eschales. Eschare. Escharotique. Escharre. V. Eschare. Eschellohe. Esoche. Espèce. Esphlase. Espira. Esprit
265	0275	804254	Esprit
266	0276	804255	Esprit. Esquille. Esquinancie. Esquine. V. Squine. Essence. Essentiel. Essère. V. Sora. Essieu. Essoufflement. Essourisser. Esthiomène. Estiomène. V. Esthiomène. Estomac. Estragon. Estrapasser. Estroffe. Esturgeon. Esule
267	0277	804256	Esule. Etain. Etairion. Etairionnaire. Etalon. Etamage. Etampe. Etamper. Etat. Eté. Eteint. Eternuement. Ether
268	0278	804257	Ether. Ehtéré. Ethérification. Ethérifié. Ethiops. Ethmoïdal. Ethmoïde. Ethmoïdien. Ethuse. Etincelle. Etiolement. Etiologie. Etique. Etisie. Etoffé
269	0279	804258	Etoile. Etoilé. Etonné. Etonnement. Etouffement. Etoupe. Etourdissement. Etranglé. Etranglement. Etranguillon. Etrier. Etriqué. Etroit du boyau. V. Levreté. Etuve. Etuver. Euaemie. Euaesthésie. Euchlorine. Euchroé. Euchylie. Euchymie. Eucrasie. Eudiapneustie
270	0280	804259	Eudiapneustie. Eudiomètre. Eudiométrie. Eudiométrique. Euéréthisme. Euexie. Eunuque. Eupatoire. Eupepsie. Euphlogie. Euphonie. Euphorbe. Euphorbe. Euphorie. Euphraise. Eupnée. Eurhythmie. Eurychobie. Eusémie. Eusthénie. Eutaxie. Euthanasie. Euthésie. Euthymie. Eutrophie. Eutonie. Euzoodynamie. Evacuant
271	0281	804260	Evacuant. Evacuatif. V. Evacuant. Evacuation. Evanouissement. Evaporable. Evaporation. Evaporer. Evaux. Event. Eventration. Everticule. Evester. Evolution. Evroult (Saint-). Evulsif. Evulsion. Exacerbation. Exalme. Exaltation. Examblome. V. Examblosie. Examblosie. Exanie. Exanthémateux. V. Exanthématique. Exanthématique. Exanthème. Exanthropie. Exaragme. Exarchiatre. Exarme. Exarthrème
272	0282	804261	Exarthrome. V. Exarthrème. Exarthrose. V. Exarthrème. Exarticulation. V. Exarthrème. Exaspération. Excarnation. Excavation. Excipient. Excision. Excitabilité. Excitant. Excitateur. Excitation. Excitement. Excoriation. Excréation. V. Exscréation. Excrément. Excrémenteux. Excrémentitiel. Excrémento-recrémentitiel. Excréteur. Excrétion. Excrétoire. Excroissance
273	0283	804262	Excroissance. Excussion. Excutia. Exelcose. Exelcysme. Exerame. Exercice. Exérèse. Exerrhose. Exfoliatif. Exfoliation. Exhalaison. Exhalant. Exhalation. Exhalatoire. Exinanition. Exiture. Ex-occipital. Exoche. Exocyste. Exoène. V. Exoine. Exoine. Exombilication. V. Exomphale. Exomètre. Exomphale
274	0284	804263	Exomphale. Exonéirose. Exophthalmie. Exorbitisme. Exorescence. Exostose. Exoticadénie. Exoticomanie. Exotique. Expansibilité. Expansible. Expansif. Expansion. Expectant. Expectantisme. Expectation
275	0285	804264	Expectation. Expectorant. Expectoration. Expectoré. Expérience. Expériment. Expérimentateur. Expert. Expirateur. Expiration. Exploration. Explorer. Explosif. Expression. Expulsif. Exsangue ou exsanguin. Exscréation. Exspuition. Exstrophie. Exsuccion. Exsudation
276	0286	804265	Exsudation. Extase. Extemporané. Extenseur. Extensibilité. Extension
277	0287	804266	Extension. Exténuation. Extérieur. Externe. Extinction. Extirpation. Extirper. Extozoaire. Extractif. Extraction. Extrait
278	0288	804267	Extrait. Extravasation. Extravasé. Extrémité. Extrinsèque. Extroversion. Extumescence. Exubérance. Exubère. Exudation. V. Exsudation. Exulcération. Exustion. V. Cautérisation. Exutoire. F. Fabagelle. Face. Facette
279	0289	804268	Facette. Facial. Facies. Factice. Faculté. Fagarier. Fagoue. Faible. Faiblesse. Faim. Faine. Faisceau. Fait. Falciforme. Falltbank. Falsification. Famille. Fanon
280	0290	804269	Fanon. Farcin. Farcineux. Fard. Farinacé. Farine. Farineux. Fascia
281	0291	804270	Fascia. Fasciation. Fascicule. Fasciole. Fatuité. V. Folie. Faucher. Fausse angusture. Faux
282	0292	804271	Faux. Faux. Faveux. Faviforme. V. Faveux. Fébricitant. Fébrifuge. Fébrile. Fécal. Féces. Fécondation. Fécondité. Fécule. Féculent. Féculite
283	0293	804272	Fégarite. Feindre. Feinte. Fêlure. Femelle. Féminin. Femme. Fémoral. Fémoro-calcanien. Fémur. Fenêtre. Fenêtré. Fenouil. Fente. Fenu-grec. Fer
284	0294	804273	Fer. Férine. Ferment. Fermentation. Fermenter. Fermentescible. Féron. Ferremens. Ferrer. Ferrières-Beschet. Ferro-chyazique. V. Chyazique ferruré. Ferrugineux. Fertier. Férule. Fesse. Fessier
285	0295	804274	Fessier. Fétide. Fétidité. Feu. Feuille. Feuillet. Feurs. Feux. Fève. Fibre. Fibreux
286	0296	804275	Fibreux. Fibrillaire. Fibrille. Fibrinte. Fibrineux. Fibro-cartilage. Fibulation. V. Bouclement. Fic. Ficaire. Fiel. Fièvre
287	0297	804276	Fièvre
288	0298	804277	Fièvre
289	0299	804278	Fièvre
290	0300	804279	Fièvre
291	0301	804280	Fièvre
292	0302	804281	Fièvre. Fiévreux. Figue. Figure. Filaire. Filament. Filet. Filiforme. Filipendule. Filon. Filtration. Filtre. Filtrer. Fiole. Firmin (Saint-). Fissiculation. Fissure
293	0303	804282	Fissure. Fistule. Fistuleux. Fixation. Fixe. Fixé. Fixen. Fixer. Fixin. Fixité. Flabellation. Flaccidité. Flamboise. Flamme. Flanc
294	0304	804283	Flanc. Flatueux. Flatulence. Flatuosité. Fléchisseur
295	0305	804284	Fléchisseur. Flegmatique. V. Phlegmatique. Flegme. V. Phlegme. Flétrive. Fleur. Fleuraison. Fleurette. Fleuron. Fleurs. Flexibilité. Flexible. Flexion. Flocon. Floconneux. Florac. Floret (Saint-). Flos. Flosculeux. Fluate. Fluctuation. Fluer. Flueurs. Fluide
296	0306	804285	Fluidification. Fluidifié. Fluidifier. Fluidité. Fluo-borate. Fluo-borique ou phthoro-borique. Fluor ou phthore. Fluoracide ou phthoracide. Fluorique. Fluo-silicate. Fluo-silicique. Fluorure, fluure ou phthorure. Flux. Fluxion. Focal. Focile. Foetal. Foetus. Foie
297	0307	804286	Foie. Foil. Foliacé. Folie. Foliforme. Foliole. Follette. Folliculaire. Follicule. Fomentation. Fonction. Fondant
298	0308	804287	Fondant. Fondement. Fongiforme. Fongoïde. Fongosité. Fongueux. Fongus. Fonsange. Fontaine. Fontanelle. Fontenelles. Fonticule. Fontigny. Force
299	0309	804288	Force. Force-Réal. Forceps. Forcer. Forges. Forme. Formiate. Formicant. Formication. Formique. Formulaire. Formule. Formuler. Fortifiant. Fortrait. Fortraiture. Fosse
300	0310	804289	Fosse. Fossette. Foucaude. Fougère. Foulure. Fourbu. Fourbure. Fourches. Fourchette. Fourmi. Fourmilière. Fourneau. Foyer. Fracture. Fragile. Fragilité
301	0311	804290	Fragilité. Fragment. Fragon. Fraisier. Framboise. Franche-mulle. Franges. Frangibilité. Frangipane. Fraxinelle. Frayeur nocturne. V. Panophobie. Frein ou filet. Frémissement. Frêne. Frène. Frénésie. V. Phrénésie. Fréquence. Fréquent. Friabilité
302	0312	804291	Friable. Friction. Frigidité. Frigorifique. Frigorique. Frisson. Frissonnement. Fritte. Frizon. Froid. Fromage. Froment. Fronde. Front. Frontal. Frontal
303	0313	804292	Frontal. Fronto-conchien. Frottement. Fructification. Fructiforme. Frugalité. Fruges. Frugivore. Fruit. Fruticuleux. Frutiqueux. Fugace. Fuligineux. Fulminant. Fulmination. Fumée. Fumeterre. Fumigation. Fungate. Fungine
304	0314	804293	Fungine. Fungique. Furculaire. Fureur. Furfuracé. Furie. Furoncle. Fusain. Fusée. Fusibilité. Fusible. Fusiforme. Fusion
305	0315	804294	G. Gabellum. V. Glabelle. Gadolinite. Gaïac. V. Gayac. Gaïacine. V. Gayacine. Gaîne. Galactacrasie. Galactique. Galactirrhée. Galactophage. Galactophore. Galactoplanie. Galactopoièse. Galactopoiétique. Galactoposie. Galactopote. Galactopyre. Galactose. Galacturie. Galanga. Galbanum
306	0316	804295	Galbanum. Galbule. Gale. Galé. Galéanthropie. Galega. Galène. Galénique. Galénisme. Galéniste. Galéope. Galipot. Gallate. Galle
307	0317	804296	Galle. Gallique. Galmier (Saint-). Galop. Galoper. Galvanique. Galvanisme. Galvanomètre. V. Electromètre. Galvanoscope. V. Electroscope. Gamarde. Gamme. Gan. Ganache. Gangliforme. Ganglion
308	0318	804297	Ganglion. Ganglionique. Ganglionnaire. Gangrène. Gangréneux. Gantelet. Garance. Garantie. Garde-malade. Garde-robe. Gargale. Gargaréon. Gargariser (se). Gargarisme. Gargouillement. Garniture. Garot. Garou. Garoutte. V. Garou. Garrot
309	0319	804298	Garrot. Garum. Gastein. Gaster. Gastéralgie. V. Gastralgie. Gastérananax. Gastérangiemphraxie. Gastralgie. Gastricisme. Gastricité. Gastriloque. Gastrique. Gastrite. Gastro-adynamique. Gastro-arachnoïdite. Gastro-arthrite. Gastro-ataxique. Gastro-bronchite
310	0320	804299	Gastrobrosie. Gastro-cardite. Gastrocèle. Gastrocélie. V. Gastrocèle. Gastro-céphalite. Gastro-cholécystite. Gastrocnémiens. Gastro-colique. Gastro-colite. Gastro-cystite. Gastro-dermite. Gastro-duodénal. Gastro-duodénite. Gastro-duodéno-cholécystite. Gastrodynie. Gastro-encéphalite. Gastro-entérite. Gastro-entéro-colite. Gastro-épiploïque. Gastro-épiploïte. Gastro-hépatique. Gastro-hépatite. Gastro-humérien
311	0321	804300	Gastro-humérien. Gastro-hystérotomie. Gastro-inflammatoire. Gastro-intestinal. V. Embarras gastro-intestinal. Gastro-laryngite. Gastromancie. Gastro-méininginite. Gastro-méningite. V. Gastro-méninginite. Gastro-métrite. Gastro-muqueux. Gastro-néphrite. Gastro-oesophagite. Gastro-péricardite. Gastro-péritonite. Gastro-pharyngite. Gastro-phrénique. Gastro-pleurésie. Gastro-pneumonie. Gastro-pylorique. Gastroraphie. Gastrorrhagie. Gastrose. Gastro-splénique. Gastro-splénite. Gastro-thoracique. Gastrotomie. Gastro-uréthrite. Gateau fébrile
312	0322	804301	Gateau fébrile. Gattilier. Gauchin. Gayac. Gayacine. Gaz. Gazéifier. Gazéiforme. Gazeux. Gazochimie. Gazolitre. Gazomètre. Géant. Geilnau. Géiologie. Geismar. Gélasme. Gélatine. Gélatineux. Gélatiniforme. Gelée. Géminé. Gemmation. Gemmipare
313	0323	804302	Gemmipare. Gemmule. Génal. Gencival. Gencive. Génépi. Générateur. Génération. Généreux. Génésie. Genêt. Généthliaque. Généthliologie. Genévrier. Gengivite. Géniculé. V. Genouillé. Génie. Génien. Genièvre. Génio-glosse. Génio-hyoïdien. Génio-pharyngien. Génital. Génito-crural. Génitoires
314	0324	804303	Génitores. Génito-urinaire. Géniture. Genou. Genouillé. Genre. Genseng. V. Ginseng. Gentiane. Gentianine. Géogénie. Géognosie. Géogonie. V. Géogénie. Géographie. Géologie. Géologue. Géomancie. Géoscopie. Géranion. Gerçure. Germandrée. Germe. Germé. Germer. Germination. Gérocomie. Gésier. Gesse
315	0325	804304	Gesse. Gesta. Gestation. Geste. Gesticulation. Gibbosité. Giboulée. Gigantologie. Gigantostéologie. Gigoté. Gin. Gingembre. Ginglyforme. V. Ginglymoïdal. Ginglyme. Ginglymoïdal. Ginglymoïde. V. Ginglymoïdal. Ginolles. Ginseng. Giroflier. Giroux
316	0326	804305	Givre. Glabelle. Glabre. Glabriuscule. Glace. Glacial. Gladié. Glaire. Glaireux. Gland. Glande. Glandé. Glande de Harder. Glandiforme
317	0327	804306	Glandiforme. Glandulaire. Glanduleux. Glaucome. Glayeul. Glène. Glénoïdal. Glénoïde. Glénoïdien. Gliadine. Globe. Globulaire. Globule. Globuleux. Glossalgie. Glossanthrax. Glossien. Glossite. Glossocatoche
